[
  {
    "resource_id": "utsc-bridge-excel-learning-series",
    "title": "UTSC BRIDGE: Excel Learning Series with Practice Datasets",
    "resource_type": "tutorial",
    "skill_ids": [
      "excel"
    ],
    "level": "beginner",
    "eligibility_note": "Open educational materials available to users inside and outside U of T; no Management enrolment requirement. Practice requires access to compatible spreadsheet software. No certificate is promised.",
    "source_url": "https://www.utsc.utoronto.ca/thebridge/bridge-excel-learning-series",
    "verified_at": "2026-10-28T01:58:14Z",
    "mapping_evidence": "The series teaches Excel functions, calculations, data cleaning, organization and analysis using short videos, slides and practice spreadsheets."
  },
  {
    "resource_id": "utsc-bridge-excel-intermediate",
    "title": "UTSC BRIDGE: Excel Tables, Data Validation and Analysis ToolPak",
    "resource_type": "tutorial",
    "skill_ids": [
      "excel"
    ],
    "level": "intermediate",
    "eligibility_note": "Open educational series; complete basic Excel training first. Some ToolPak and macro exercises require a compatible desktop Excel installation.",
    "source_url": "https://www.utsc.utoronto.ca/thebridge/excel-learning-series-intermediate-level",
    "verified_at": "2026-10-28T01:58:14Z",
    "mapping_evidence": "The intermediate series demonstrates Excel tables, advanced filters, data validation, ToolPak regression and sampling, and introductory macros."
  },
  {
    "resource_id": "utsc-library-foundational-data-literacy",
    "title": "UTSC Library: Foundational Data Literacy Skills Course",
    "resource_type": "course",
    "skill_ids": [
      "excel"
    ],
    "level": "beginner",
    "eligibility_note": "Free self-paced course for undergraduate and graduate students and university staff; a community route is also linked. Exercises support Excel or Google Sheets. CCR requires all 10 modules, all quizzes and a one-page reflection. Quercus enrolment and completion were not tested.",
    "source_url": "https://www.utsc.utoronto.ca/thebridge/utsc-library-foundational-data-literacy-skills-course",
    "verified_at": "2026-10-28T01:58:14Z",
    "mapping_evidence": "The course uses Excel or Google Sheets for data cleaning, sorting and pivot tables, with 10 self-directed modules and quizzes. The Excel mapping applies to the Excel route; a Sheets-only completion does not establish Excel experience."
  },
  {
    "resource_id": "uoft-mdl-r-self-paced",
    "title": "U of T Map & Data Library: R - An Introduction",
    "resource_type": "course",
    "skill_ids": [
      "r"
    ],
    "level": "beginner",
    "eligibility_note": "University library roadmap links a Quercus self-paced course. UTORid sign-in may be required; enrolment, fee and certificate conditions behind sign-in were not verified. No Management-only restriction is stated on the roadmap.",
    "source_url": "https://mdl.library.utoronto.ca/support/workshops-training/learning-roadmaps",
    "verified_at": "2026-10-28T01:58:14Z",
    "mapping_evidence": "The library roadmap explicitly lists R - An Introduction as an online course under data analysis and programming. Use its R course link, not an expired live session."
  },
  {
    "resource_id": "uoft-mdl-tableau-self-paced",
    "title": "U of T Map & Data Library: Data Visualization - Practice with Tableau",
    "resource_type": "course",
    "skill_ids": [
      "tableau"
    ],
    "level": "beginner",
    "eligibility_note": "University library roadmap links the Part 2 Tableau practice course in Quercus. UTORid sign-in may be required; enrolment, fees and software entitlement were not verified. No completion credential is promised.",
    "source_url": "https://mdl.library.utoronto.ca/support/workshops-training/learning-roadmaps",
    "verified_at": "2026-10-28T01:58:14Z",
    "mapping_evidence": "The library lists Data Visualization - An Introduction, Part 2 - Practice with Tableau as an online course. Part 1 theory is complementary, not proof of Tableau practice."
  },
  {
    "resource_id": "uoft-scinet-git-self-paced",
    "title": "U of T SciNet: DAT161 Introduction to Git Version Control",
    "resource_type": "course",
    "skill_ids": [
      "git"
    ],
    "level": "beginner",
    "eligibility_note": "SciNet lists non-graduate-course training as free. This self-paced course links to sign-in: use a CCDB account, or request access from courses@scinet.utoronto.ca if affiliated with a Canadian academic institution and unable to obtain one. Logged-in access was not tested.",
    "source_url": "https://education.scinet.utoronto.ca/course/view.php?id=1382",
    "verified_at": "2026-10-28T01:58:14Z",
    "mapping_evidence": "SciNet explicitly lists DAT161 Intro to Git Version Control as a self-paced course."
  },
  {
    "resource_id": "uoft-scinet-python-recordings",
    "title": "U of T SciNet: Introduction to Programming in Python - Course Archive",
    "resource_type": "course",
    "skill_ids": [
      "python"
    ],
    "level": "beginner",
    "eligibility_note": "Free training archive, not a currently scheduled live class. SciNet says most past course recordings and slides are openly available; individual access may require guest access or login. Follow SCMP142 in the catalogue. No automatic certificate is promised.",
    "source_url": "https://education.scinet.utoronto.ca/theme/scinet3/course/index2.php",
    "verified_at": "2026-10-28T01:58:14Z",
    "mapping_evidence": "The SciNet catalogue lists SCMP142 Introduction to Programming in Python and past offerings with course materials. This entry is an archive route, not a claim of current registration."
  },
  {
    "resource_id": "utsc-fmi-foundations",
    "title": "UTSC BRIDGE: FMI Foundations in Financial Modeling",
    "resource_type": "course",
    "skill_ids": [],
    "level": "beginner",
    "eligibility_note": "The university page advertises the Foundations program free for UTSC Management and Economics students using a U of T email. It describes a 15-hour program and online exam for a digital badge. Eligibility redemption was not tested. AFM accreditation and its exam are separate paid offerings; past scholarship deadlines do not establish a current offer.",
    "source_url": "https://www.utsc.utoronto.ca/thebridge/financial-modeling-institute-certificates",
    "verified_at": "2026-10-28T01:58:14Z",
    "mapping_evidence": "The school describes financial modeling best practices, model design and financial statements. No current tool skill is assigned without explicit tool evidence; this is a finance exploration resource, not a tool-gap match."
  },
  {
    "resource_id": "uoft-bloomberg-market-concepts",
    "title": "U of T Library: Bloomberg Market Concepts Registration Guide",
    "resource_type": "course",
    "skill_ids": [],
    "level": "beginner",
    "eligibility_note": "UTM Library describes BMC as a free self-paced online program for U of T students using their university email. Actual account entitlement was not tested; follow the university instructions and verify before paying. Online course eligibility does not grant access to every campus terminal or other Bloomberg certificates.",
    "source_url": "https://library.utm.utoronto.ca/flc/bloomberg-certifications-quick-start-guide",
    "verified_at": "2026-10-28T01:58:14Z",
    "mapping_evidence": "The university guide describes financial-market modules and quizzes leading to a BMC certificate. Bloomberg is not in the current tool catalog, so no tool-gap skill is inferred."
  },
  {
    "resource_id": "uoft-coursera-consortium",
    "title": "U of T: Coursera Partner Consortium Access",
    "resource_type": "other",
    "skill_ids": [],
    "level": "unknown",
    "eligibility_note": "Official university access portal, not an individual course. Active U of T students may access selected offerings and completion certificates at no cost using mail.utoronto.ca. Catalogues can change; courses requesting payment may be outside the program. Current signed-in entitlement and individual courses were not tested.",
    "source_url": "https://onlinelearning.utoronto.ca/coursera/",
    "verified_at": "2026-10-28T01:58:14Z",
    "mapping_evidence": "The university describes access to selected Coursera courses. A general platform entitlement does not establish a Python, SQL or other tool mapping; individual courses need separate verification."
  },
  {
    "resource_id": "utsc-entrepreneurship-open-learning",
    "title": "UTSC BRIDGE: Entrepreneurship Open Learning Series",
    "resource_type": "course",
    "skill_ids": [],
    "level": "beginner",
    "eligibility_note": "Free, publicly accessible self-paced modules welcome non-business students and community members. Interactive content includes worksheets and rubrics. No software entitlement, academic credit or completion certificate is assumed.",
    "source_url": "https://utsc.utoronto.ca/thebridge/entrepreneurship-open-learning-series",
    "verified_at": "2026-10-28T01:58:14Z",
    "mapping_evidence": "The five modules address entrepreneurship, value propositions, target markets and market research. This is direction exploration; no current tool skill is inferred."
  },
  {
    "resource_id": "tableau-superstore-guided-analysis",
    "title": "Tableau: Superstore Sales and Profit Dashboard",
    "resource_type": "tutorial",
    "skill_ids": [
      "tableau"
    ],
    "level": "beginner",
    "eligibility_note": "Official guided case; requires a suitable Tableau installation and the sample data. Check software licensing and publishing conditions for the chosen edition. Public sharing is optional; use sample rather than private data.",
    "source_url": "https://help.tableau.com/current/guides/get-started-tutorial/en-us/get-started-tutorial-home.htm",
    "verified_at": "2026-10-28T01:58:14Z",